nom;adresse;code_postal;latitude;longitude;region_source
Agence bancaire ABBEVILLE PORTE BAIE DE SOMME;17 RUE DES LINGERS, 80100 ABBEVILLE;80100;;;Crédit Agricole - Brie Picardie
Agence bancaire ACHEUX EN AMIENOIS;30 RUE DE WAZIERES, 80560 ACHEUX EN AMIENOIS;80560;;;Crédit Agricole - Brie Picardie
Agence bancaire AILLY SUR NOYE;54 RUE SADI CARNOT, 80250 AILLY SUR NOYE;80250;;;Crédit Agricole - Brie Picardie
Agence bancaire AILLY SUR SOMME;2 RUE BROSSOLETTE, 80470 AILLY SUR SOMME;80470;;;Crédit Agricole - Brie Picardie
Agence bancaire AIRAINES;2 place du Commandant SEYMOUR, 80270 AIRAINES;80270;;;Crédit Agricole - Brie Picardie
Agence bancaire ALBERT;36 RUE DE BIRMINGHAM, 80301 ALBERT;80301;;;Crédit Agricole - Brie Picardie
Agence en ligne AMIENS Brie Picardie Direct;Bâtiment Cytises Centre OASIS - Allée de la Pépinière, 80480 Dury;80480;49,860858;2,279368;Crédit Agricole - Brie Picardie
Agence bancaire AMIENS CAGNY;517 RUE DE CAGNY, 80090 AMIENS;80090;49,87548;2,3293591;Crédit Agricole - Brie Picardie
Agence bancaire AMIENS CENTRE D'AFFAIRES ENTREPRISES;500 Rue Saint-Fuscien, 80090 Amiens;80090;49,8703606;2,3064154;Crédit Agricole - Brie Picardie
Agence bancaire AMIENS COEUR DE VILLE;60 Rue des 3 Cailloux, 80000 AMIENS;80000;49,89164539999999;2,3015354;Crédit Agricole - Brie Picardie
Agence bancaire AMIENS CROIX ROMPUE;500 RUE SAINT FUSCIEN, 80000 AMIENS;80000;49,8700091;2,307334;Crédit Agricole - Brie Picardie
Agence bancaire AMIENS FAUBOURG DE HEM;91 ROUTE D'ABBEVILLE, 80000 AMIENS;80000;49,9057638;2,2713688;Crédit Agricole - Brie Picardie
Agence bancaire AMIENS JULES BARNI;169 RUE JULES BARNI, 80097 AMIENS;80097;49,8875307;2,3148065;Crédit Agricole - Brie Picardie
Agence bancaire AMIENS LIBERATION;306 ROUTE DE ROUEN, 80000 AMIENS;80000;49,8865873;2,2790341;Crédit Agricole - Brie Picardie
Agence bancaire AMIENS MAIL;39 boulevard Maignan Larivière, 80000 AMIENS;80000;49,889218;2,2947285;Crédit Agricole - Brie Picardie
Agence bancaire AMIENS PIERRE ROLLIN;CENTRE CCIAL - RUE 8 MAI 1945, 80000 AMIENS;80000;49,8744877;2,3100923;Crédit Agricole - Brie Picardie
Agence bancaire AMIENS SAINT PIERRE;136 CHAUSSEE ST PIERRE, 80015 AMIENS;80015;49,9036216;2,3072123;Crédit Agricole - Brie Picardie
Agence bancaire AUNEUIL;4 rue de la Gare, 60390 AUNEUIL;60390;;;Crédit Agricole - Brie Picardie
Agence bancaire AVON;58 AVENUE FRANKLIN ROOSEVELT, 77210 AVON;77210;;;Crédit Agricole - Brie Picardie
Agence bancaire BAILLY ROMAINVILLIERS;42 RUE DE MAGNY, 77700 BAILLY ROMAINVILLIERS;77700;;;Crédit Agricole - Brie Picardie
Agence bancaire BEAUCAMPS LE VIEUX;8 RUE DE LA LIBERATION, 80430 BEAUCAMPS LE VIEUX;80430;;;Crédit Agricole - Brie Picardie
Agence bancaire BEAUMONT DU GÂTINAIS;8 Rue du Mail Est, 77890 BEAUMONT-DU-GÂTINAIS;77890;;;Crédit Agricole - Brie Picardie
Agence bancaire BEAUVAIS AGEL;4 RUE Maurice SEGONDS, 60000 BEAUVAIS;60000;49,420894;2,075652;Crédit Agricole - Brie Picardie
Agence bancaire BEAUVAIS CALAIS;115 RUE DE CALAIS, 60000 BEAUVAIS;60000;49,440595;2,0810641;Crédit Agricole - Brie Picardie
Agence bancaire BEAUVAIS CARNOT;38, rue Carnot, 60000 BEAUVAIS;60000;49,4322505;2,0844295;Crédit Agricole - Brie Picardie
Agence bancaire BEAUVAIS CENTRE;16 PlACE JEANNE HACHETTE, 60000 BEAUVAIS;60000;49,4295573;2,0866894;Crédit Agricole - Brie Picardie
Agence bancaire BEAUVAIS CENTRE D'AFFAIRES ENTREPRISES;1 Avenue du Beauvaisis, 60000 BEAUVAIS;60000;49,4340091;2,1202203;Crédit Agricole - Brie Picardie
Agence bancaire BEAUVAIS HAUT-VILLE;1 AVENUE DU BEAUVAISIS, 60000 BEAUVAIS;60000;49,436416;2,12158;Crédit Agricole - Brie Picardie
Agence bancaire BEAUVAIS SAINT QUENTIN;1 RUE DES FILATURES, 60000 BEAUVAIS;60000;49,4302153;2,0704958;Crédit Agricole - Brie Picardie
Agence bancaire BEAUVAIS VOISINLIEU;115 RUE DE PARIS, 60000 BEAUVAIS;60000;49,4187197;2,0955855;Crédit Agricole - Brie Picardie
Agence bancaire BERNAVILLE;39 ROUTE NATIONALE, 80370 BERNAVILLE;80370;;;Crédit Agricole - Brie Picardie
Agence bancaire BETHISY SAINT PIERRE;83 AVENUE DE LA GARE, 60320 BETHISY SAINT PIERRE;60320;;;Crédit Agricole - Brie Picardie
Agence bancaire BOIS LE ROI;4 RUE DE FRANCE, 77590 BOIS LE ROI;77590;;;Crédit Agricole - Brie Picardie
Agence bancaire BORAN SUR OISE;8 PLACE BOURGEOIS, 60820 BORAN SUR OISE;60820;;;Crédit Agricole - Brie Picardie
Agence bancaire BORNEL;2 Rue Lamartine, 60540 Bornel;60540;;;Crédit Agricole - Brie Picardie
Agence bancaire BRAY SUR SEINE;2 RUE DE L'HOPITAL, 77480 BRAY SUR SEINE;77480;;;Crédit Agricole - Brie Picardie
Agence bancaire BRAY SUR SOMME;8 RUE PASTEUR, 80340 BRAY SUR SOMME;80340;;;Crédit Agricole - Brie Picardie
Agence bancaire BRESLES;40 RUE GENERAL DE GAULLE, 60510 BRESLES;60510;;;Crédit Agricole - Brie Picardie
Agence bancaire BRETEUIL;2, rue d'Amiens, 60120 BRETEUIL;60120;;;Crédit Agricole - Brie Picardie
Agence bancaire BRIE COMTE ROBERT;18 AVENUE VICTOR HUGO, 77170 BRIE COMTE ROBERT;77170;;;Crédit Agricole - Brie Picardie
Agence bancaire BUSSY SAINT GEORGES - LAGNY;18 BOULEVARD DE LAGNY, 77600 BUSSY SAINT GEORGES;77600;;;Crédit Agricole - Brie Picardie
Agence bancaire CAMON;7 RUE EMILE DEBRIE, 80450 CAMON;80450;;;Crédit Agricole - Brie Picardie
Agence bancaire CESSON;14 AVENUE CHARLES MONIER, 77240 CESSON;77240;;;Crédit Agricole - Brie Picardie
Agence bancaire CHAMBLY;259, place Charles de Gaulle, 60230 CHAMBLY;60230;;;Crédit Agricole - Brie Picardie
Agence bancaire CHAMPAGNE SUR SEINE;14 RUE PASTEUR, 77430 CHAMPAGNE SUR SEINE;77430;;;Crédit Agricole - Brie Picardie
Agence bancaire CHAMPS PYRAMIDES;41,43  AVENUE DE LA REPUBLIQUE, 77420 CHAMPS SUR MARNE;77420;;;Crédit Agricole - Brie Picardie
Agence bancaire CHANTILLY;16 AVENUE DU MARECHAL JOFFRE, 60500 CHANTILLY;60500;;;Crédit Agricole - Brie Picardie
Agence bancaire CHATEAU LANDON;4 PLACE DU GENERAL LECLERC, 77420 CHATEAU LANDON;77420;;;Crédit Agricole - Brie Picardie
Agence bancaire CHAULNES;PLACE DE LA REPUBLIQUE, 80320 CHAULNES;80320;;;Crédit Agricole - Brie Picardie
Agence bancaire CHAUMONT EN VEXIN;2 RUE HOTEL DE VILLE, 60240 CHAUMONT EN VEXIN;60240;;;Crédit Agricole - Brie Picardie
Agence bancaire CHELLES AULNOY;27 BOULEVARD PIERRE MENDES FRANCE, 77500 CHELLES;77500;48,8756016;2,595419;Crédit Agricole - Brie Picardie
Agence bancaire CHELLES FOCH;17,19  Avenue du Maréchal FOCH, 77500 CHELLES;77500;48,8723926;2,578795;Crédit Agricole - Brie Picardie
Agence bancaire CHELLES RESISTANCE;23 AVENUE DE LA RESISTANCE, 77500 CHELLES;77500;48,8775777;2,5861789;Crédit Agricole - Brie Picardie
Agence bancaire CHESSY ARIANE;25 PLACE D'ARIANE, 77700 CHESSY;77700;48,85614398130463;2,769240415094667;Crédit Agricole - Brie Picardie
Agence bancaire CHESSY CENTRE D'AFFAIRES ENTREPRISES;8 ROND-POINT SIMONE VEIL, 77700 CHESSY;77700;48,8563211;2,7704285;Crédit Agricole - Brie Picardie
Agence bancaire CLAYE SOUILLY;78 RUE JEAN JAURES, 77410 CLAYE SOUILLY;77410;;;Crédit Agricole - Brie Picardie
Agence bancaire CLERMONT;5 RUE DU GENERAL PERSHING, 60600 CLERMONT;60600;;;Crédit Agricole - Brie Picardie
Agence bancaire COMBLES;10 RUE 73 RGT INFANTERIE, 80360 COMBLES;80360;;;Crédit Agricole - Brie Picardie
Agence bancaire COMBS GARE;49 AVENUE DE LA REPUBLIQUE, 77380 COMBS LA VILLE;77380;48,6656585;2,5507069;Crédit Agricole - Brie Picardie
Agence bancaire COMBS LA VILLE;64 RUE SERMONOISE, 77380 COMBS LA VILLE;77380;48,6633766;2,5670162;Crédit Agricole - Brie Picardie
Agence bancaire COMPIEGNE CENTRE;5 RUE FOURNIER SARLOVEZE, 60200 COMPIEGNE;60200;49,4176942;2,8305585;Crédit Agricole - Brie Picardie
Agence bancaire COMPIEGNE ROYALLIEU POMPIDOU;esplanade Marguerite Perey, 60200 COMPIEGNE;60200;49,394196;2,793986;Crédit Agricole - Brie Picardie
Agence bancaire COMPIEGNE SAINT CORNEILLE;18 RUE SAINT CORNEILLE, 60200 COMPIEGNE;60200;49,4172942;2,8241875;Crédit Agricole - Brie Picardie
Agence bancaire CONTY;22 rue du Général Leclerc, 80160 CONTY;80160;;;Crédit Agricole - Brie Picardie
Agence bancaire CORBIE;5 RUE CHARLES DE GAULLE, 80800 CORBIE;80800;;;Crédit Agricole - Brie Picardie
Agence bancaire COULOMMIERS;3 COURS GAMBETTA, 77120 COULOMMIERS;77120;;;Crédit Agricole - Brie Picardie
Agence bancaire CRECY LA CHAPELLE;8 RUE DU GENERAL LECLERC, 77580 CRECY LA CHAPELLE;77580;;;Crédit Agricole - Brie Picardie
Agence bancaire CREIL GARE;27, avenue Jules Uhry, 60100 CREIL;60100;49,2636439;2,469645;Crédit Agricole - Brie Picardie
Agence bancaire CREIL PLATEAU;14, Avenue Marie et Pierre Curie, 60100 CREIL;60100;49,2523443;2,481064796;Crédit Agricole - Brie Picardie
Agence bancaire CREIL REPUBLIQUE;33 RUE DE LA REPUBLIQUE, 60100 CREIL;60100;49,2598361;2,4753168;Crédit Agricole - Brie Picardie
Agence bancaire CREPY EN VALOIS;72 RUE NATIONALE, 60800 CREPY EN VALOIS;60800;;;Crédit Agricole - Brie Picardie
Agence bancaire CREVECOEUR LE GRAND;4, avenue du Château, 60360 CREVECOEUR-LE-GRAND;60360;;;Crédit Agricole - Brie Picardie
Agence bancaire CRECY EN PONTHIEU;55 Rue du Général de Gaulle, 80150 CRÉCY-EN-PONTHIEU;80150;;;Crédit Agricole - Brie Picardie
Agence bancaire CUISE LA MOTTE;34 RUE DE SOISSONS, 60350 CUISE LA MOTTE;60350;;;Crédit Agricole - Brie Picardie
Agence bancaire DAMMARIE LES LYS;69, rue Moulin, 77190 DAMMARIE LES LYS;77190;;;Crédit Agricole - Brie Picardie
Agence bancaire DAMMARTIN EN GOELE;7 RUE DE LA JUSTICE, 77230 DAMMARTIN EN GOELE;77230;;;Crédit Agricole - Brie Picardie
Agence bancaire DOMART EN PONTHIEU;9 RUE DE LA PREE, 80620 DOMART EN PONTHIEU;80620;;;Crédit Agricole - Brie Picardie
Agence bancaire DONNEMARIE DONTILLY;33 RUE MARIE CHAUBARD, 77520 DONNEMARIE DONTILLY;77520;;;Crédit Agricole - Brie Picardie
Agence bancaire DOULLENS;55 - 59 RUE DU BOURG, 80600 DOULLENS;80600;;;Crédit Agricole - Brie Picardie
Agence bancaire Amiens Brie Picardie Direct;Bâtiment Cytises centre OASIS - Allée de la Pépinière, 80480 Dury;80480;49,860858;2,279368;Crédit Agricole - Brie Picardie
Agence bancaire Centre de Relation Client Pôle 3C;Bâtiment Cytises Centre OASIS - Allée de la Pépinière, 80480 Dury;80480;49,860858;2,279368;Crédit Agricole - Brie Picardie
Agence bancaire EGREVILLE;38 PLACE MASSENET, 77620 EGREVILLE;77620;;;Crédit Agricole - Brie Picardie
Agence bancaire ESBLY;12 avenue Charles de Gaulle, 77450 ESBLY;77450;;;Crédit Agricole - Brie Picardie
Agence bancaire ETREPAGNY;70 RUE GEORGES CLEMENCEAU, 27150 ETREPAGNY;27150;;;Crédit Agricole - Brie Picardie
Agence bancaire FAREMOUTIERS;17 PLACE DU GENERAL DE GAULLE, 77515 FAREMOUTIERS;77515;;;Crédit Agricole - Brie Picardie
Agence bancaire FERRIERES EN BRIE;8C Avenue JAMES DE ROTSCHILD, 77164 FERRIERES EN BRIE;77164;;;Crédit Agricole - Brie Picardie
Agence bancaire FEUQUIERES EN VIMEU;RUE VICTOR HUGO, 80210 FEUQUIERES EN VIMEU;80210;;;Crédit Agricole - Brie Picardie
Agence bancaire FLIXECOURT;27 RUE ROGER GODARD, 80420 FLIXECOURT;80420;;;Crédit Agricole - Brie Picardie
Agence bancaire FONTAINEBLEAU;20 RUE DU CHATEAU, 77300 FONTAINEBLEAU;77300;;;Crédit Agricole - Brie Picardie
Agence bancaire FONTENAY TRESIGNY;25 avenue du Général de Gaulle, 77610 FONTENAY TRESIGNY;77610;;;Crédit Agricole - Brie Picardie
Agence bancaire FORMERIE;13 RUE ALBERT 1ER, 60220 FORMERIE;60220;;;Crédit Agricole - Brie Picardie
Agence bancaire FRIVILLE ESCARBOTIN;40 RUE MARIUS BRIET, 80130 FRIVILLE ESCARBOTIN;80130;;;Crédit Agricole - Brie Picardie
Agence bancaire FROISSY;RUE DU 8 MAI 1945, 60480 FROISSY;60480;;;Crédit Agricole - Brie Picardie
Agence bancaire GAMACHES;2 TER RUE CHARLES DE GAULLE, 80220 GAMACHES;80220;;;Crédit Agricole - Brie Picardie
Agence bancaire GISORS;22 Rue de Paris, 27140 GISORS;27140;;;Crédit Agricole - Brie Picardie
Agence bancaire GOUVIEUX;47 RUE DE LA MAIRIE, 60270 GOUVIEUX;60270;;;Crédit Agricole - Brie Picardie
Agence bancaire GRANDVILLIERS;5 RUE DE ROUEN, 60210 GRANDVILLIERS;60210;;;Crédit Agricole - Brie Picardie
Agence bancaire GRETZ  ARMAINVILLIERS;25 RUE DE PARIS, 77220 GRETZ  ARMAINVILLIERS;77220;;;Crédit Agricole - Brie Picardie
Agence bancaire GUIGNES;44 RUE DE TROYES, 77390 GUIGNES RABUTIN;77390;;;Crédit Agricole - Brie Picardie
Agence bancaire GUISCARD;35 Rue Hélène Versepuy, 60640 Guiscard;60640;;;Crédit Agricole - Brie Picardie
Agence bancaire HAM;45 - 47 RUE DU GENERAL FOY, 80400 HAM;80400;;;Crédit Agricole - Brie Picardie
Agence bancaire HORNOY LE BOURG;RUE D'AIRAINES, 80640 HORNOY LE BOURG;80640;;;Crédit Agricole - Brie Picardie
Agence bancaire LA CHAPELLE LA REINE;12 PLACE DE LA REPUBLIQUE, 77760 LA CHAPELLE LA REINE;77760;;;Crédit Agricole - Brie Picardie
Agence bancaire LA FERTE GAUCHER;4 PLACE DU GENERAL DE GAULLE, 77320 LA FERTE GAUCHER;77320;;;Crédit Agricole - Brie Picardie
Agence bancaire LA FERTE SOUS JOUARRE;45 RUE DE CHAMIGNY, 77260 LA FERTE SOUS JOUARRE;77260;;;Crédit Agricole - Brie Picardie
Agence bancaire LACHAPELLE AUX POTS;37 RUE TRISTAN KLINGSOR, 60650 LACHAPELLE AUX POTS;60650;;;Crédit Agricole - Brie Picardie
Agence bancaire LACROIX SAINT OUEN;68 bis et ter Route Nationale, 60610 LACROIX SAINT OUEN;60610;;;Crédit Agricole - Brie Picardie
Agence bancaire LAGNY CENTRE;41 - 43 RUE DU 27 AOUT 1944, 77400 LAGNY SUR MARNE;77400;48,877096;2,7077157;Crédit Agricole - Brie Picardie
Agence bancaire LES HAUTS DE LAGNY;Centre Commercial - 25, avenue André Malraux, 77400 LAGNY SUR MARNE;77400;48,8671385;2,7073524;Crédit Agricole - Brie Picardie
Agence bancaire LAMORLAYE;41 RUE DU GENERAL LECLERC, 60260 LAMORLAYE;60260;;;Crédit Agricole - Brie Picardie
Agence bancaire LE CHATELET EN BRIE;1 bis rue des Grands Champs, 77820 LE CHATELET EN BRIE;77820;;;Crédit Agricole - Brie Picardie
Agence bancaire LE CROTOY;11 PLACE JEANNE D'ARC, 80550 LE CROTOY;80550;;;Crédit Agricole - Brie Picardie
Agence bancaire LE MEE SUR SEINE;Centre commercial 120, allée Plein Ciel, 77350 LE MEE SUR SEINE;77350;;;Crédit Agricole - Brie Picardie
Agence bancaire LE PLESSIS BELLEVILLE;10 AVENUE GEORGES BATAILLE, 60330 LE PLESSIS BELLEVILLE;60330;;;Crédit Agricole - Brie Picardie
Agence bancaire LESIGNY;COUR VILLARCEAU, 77150 LESIGNY;77150;;;Crédit Agricole - Brie Picardie
Agence bancaire LIANCOURT;6, place de la Rochefoucauld, 60140 LIANCOURT;60140;;;Crédit Agricole - Brie Picardie
Agence bancaire LIEUSAINT;5 PLACE DU COLOMBIER, 77127 LIEUSAINT;77127;;;Crédit Agricole - Brie Picardie
Agence bancaire LIZY SUR OURCQ;6 AVENUE DE LA GARE, 77440 LIZY SUR OURCQ;77440;;;Crédit Agricole - Brie Picardie
Agence bancaire LOGNES;7 RUE DU SUFFRAGE UNIVERSEL, 77185 LOGNES;77185;;;Crédit Agricole - Brie Picardie
Agence bancaire LONGPRE LES CORPS SAINTS;Rue de la Libération, 80510 LONGPRE LES CORPS SAINTS;80510;;;Crédit Agricole - Brie Picardie
Agence bancaire LONGUEAU;16 AVENUE HENRI BARBUSSE, 80330 LONGUEAU;80330;;;Crédit Agricole - Brie Picardie
Agence bancaire LORREZ LE BOCAGE;23 RUE DES FONTAINES, 77710 LORREZ LE BOCAGE;77710;;;Crédit Agricole - Brie Picardie
Agence bancaire MAGNY LE HONGRE;11 RUE DE COURTALIN - BAT D, 77700 MAGNY LE HONGRE;77700;;;Crédit Agricole - Brie Picardie
Agence bancaire MARGNY LES COMPIEGNE;400 AVENUE OCTAVE BUTIN, 60200 MARGNY LES COMPIEGNE;60200;;;Crédit Agricole - Brie Picardie
Agence bancaire MARSEILLE EN BEAUVAISIS;RUE PHILEAS LEBESGUE, 60690 MARSEILLE EN BEAUVAISIS;60690;;;Crédit Agricole - Brie Picardie
Agence bancaire MEAUX BEAUVAL;Centre Commercial - allée JL .Barrault, 77101 MEAUX;77101;48,957705;2,881826;Crédit Agricole - Brie Picardie
Agence bancaire MEAUX CENTRE;14 RUE DU GRAND CERF, 77102 MEAUX;77102;48,9591028;2,8803684;Crédit Agricole - Brie Picardie
Agence bancaire MEAUX FOCH;4 Rue Léon le Royer, 77100 MEAUX;77100;48,9523418;2,8869862;Crédit Agricole - Brie Picardie
Agence bancaire MEAUX MARCHE;42 rue du Commandant BERGE, 77100 MEAUX;77100;48,9552563;2,8793709;Crédit Agricole - Brie Picardie
Agence bancaire MELUN CENTRE D'AFFAIRES ENTREPRISES;17, boulevard Victor Hugo, 77000 MELUN;77000;48,5394997;2,6577735;Crédit Agricole - Brie Picardie
Agence bancaire MELUN GARE;11, avenue Galliéni, 77000 MELUN;77000;48,5281218;2,6553476;Crédit Agricole - Brie Picardie
Agence bancaire MELUN VICTOR HUGO;17 BOULEVARD VICTOR HUGO, 77000 MELUN;77000;48,5394997;2,6577735;Crédit Agricole - Brie Picardie
Agence bancaire MERS LES BAINS;29 RUE MARCEL HOLLEVILLE, 80350 MERS LES BAINS;80350;;;Crédit Agricole - Brie Picardie
Agence bancaire MERU CENTRE;15 PLACE HOTEL DE VILLE, 60110 MERU;60110;49,2360342;2,1353504;Crédit Agricole - Brie Picardie
Agence bancaire MERU VILLAGES;25 BOULEVARD PABLO PICASSO, 60110 MERU;60110;49,2345805;2,1271898;Crédit Agricole - Brie Picardie
Agence bancaire MILLY SUR THERAIN;25 RUE DE DIEPPE, 60112 MILLY SUR THERAIN;60112;;;Crédit Agricole - Brie Picardie
Agence bancaire MITRY MORY;17, av Franklin Roosevelt, 77290 MITRY MORY;77290;;;Crédit Agricole - Brie Picardie
Agence bancaire MOISSY CRAMAYEL;73 AVENUE PHILIPPE BUR, 77550 MOISSY CRAMAYEL;77550;;;Crédit Agricole - Brie Picardie
Agence bancaire MONTATAIRE;4 PLACE AUGUSTE GENIE, 60160 MONTATAIRE;60160;;;Crédit Agricole - Brie Picardie
Agence bancaire MONTDIDIER;1 PLACE DU GENERAL DE GAULLE, 80500 MONTDIDIER;80500;;;Crédit Agricole - Brie Picardie
Agence bancaire MONTEREAU;1 Rue de la Pépinière Royale, 77130 Montereau-Fault-Yonne;77130;;;Crédit Agricole - Brie Picardie
Agence bancaire MONTIGNY SUR LOING;5 RUE DE LOING, 77690 MONTIGNY SUR LOING;77690;;;Crédit Agricole - Brie Picardie
Agence bancaire MORET LOING ET ORVANNE;36 RUE GRANDE, 77250 MORET SUR LOING;77250;;;Crédit Agricole - Brie Picardie
Agence bancaire MOREUIL;5 PLACE NORBERT MALTERRE, 80110 MOREUIL;80110;;;Crédit Agricole - Brie Picardie
Agence bancaire MORMANT;32 RUE CHARLES DE GAULLE, 77720 MORMANT;77720;;;Crédit Agricole - Brie Picardie
Agence bancaire MOUY;14 PLACE CANTREL, 60250 MOUY;60250;;;Crédit Agricole - Brie Picardie
Agence bancaire NANGIS;11 RUE PASTEUR, 77370 NANGIS;77370;;;Crédit Agricole - Brie Picardie
Agence bancaire NANTEUIL LE HAUDOUIN;6 RUE DE LA CROIX VERTE, 60440 NANTEUIL LE HAUDOUIN;60440;;;Crédit Agricole - Brie Picardie
Agence bancaire NEMOURS;14 PLACE JEAN JAURES, 77140 NEMOURS;77140;;;Crédit Agricole - Brie Picardie
Agence bancaire NESLE;4 RUE DE LA MONNAIE, 80190 NESLE;80190;;;Crédit Agricole - Brie Picardie
Agence bancaire NEUILLY EN THELLE;8 PLACE TIBURCE LEFEVRE, 60530 NEUILLY EN THELLE;60530;;;Crédit Agricole - Brie Picardie
Agence bancaire NOAILLES;2 RUE DE CALAIS, 60430 NOAILLES;60430;;;Crédit Agricole - Brie Picardie
Agence bancaire NOISIEL LES LUZARDS;85 COURS DES ROCHES, 77186 NOISIEL;77186;;;Crédit Agricole - Brie Picardie
Agence bancaire NOYON;69 RUE DE PARIS, 60400 NOYON;60400;;;Crédit Agricole - Brie Picardie
Agence bancaire OISEMONT;8 RUE ROGER SALENGRO, 80140 OISEMONT;80140;;;Crédit Agricole - Brie Picardie
Agence bancaire ORRY LA VILLE;13, rue de la Gare, 60560 ORRY LA VILLE;60560;;;Crédit Agricole - Brie Picardie
Agence bancaire OTHIS;RUE DU 8 MAI 1945, 77280 OTHIS;77280;;;Crédit Agricole - Brie Picardie
Agence bancaire OZOIR LA FERRIERE;24 AVENUE DU GENERAL DE GAULLE, 77330 OZOIR LA FERRIERE;77330;;;Crédit Agricole - Brie Picardie
Agence bancaire PERONNE;15 - 17 PLACE LOUIS DAUDRE, 80204 PERONNE;80204;;;Crédit Agricole - Brie Picardie
Agence bancaire POIX DE PICARDIE;15 PLACE DE LA REPUBLIQUE, 80290 POIX DE PICARDIE;80290;;;Crédit Agricole - Brie Picardie
Agence bancaire PONT SAINTE MAXENCE;49 RUE CHARLES LESCOT, 60700 PONT SAINTE MAXENCE;60700;;;Crédit Agricole - Brie Picardie
Agence bancaire PONTAULT COMBAULT DE GAULLE;106 avenue du Général de Gaulle, 77340 PONTAULT COMBAULT;77340;48,801255;2,607598;Crédit Agricole - Brie Picardie
Agence bancaire PONTAULT COMBAULT EGLISE;95 AVENUE LUCIEN BRUNET, 77340 PONTAULT COMBAULT;77340;48,7835599;2,6005375;Crédit Agricole - Brie Picardie
Agence bancaire PONTAULT COMBAULT GARE;10 AVENUE DE LA REPUBLIQUE, 77340 PONTAULT COMBAULT;77340;48,8052303;2,6147613;Crédit Agricole - Brie Picardie
Agence bancaire PRECY SUR OISE;44 BIS RUE CH.DE GAULLE, 60460 PRECY SUR OISE;60460;;;Crédit Agricole - Brie Picardie
Agence bancaire PROVINS;12 rue du Temple, 77160 PROVINS;77160;;;Crédit Agricole - Brie Picardie
Agence bancaire RANTIGNY;88 AVENUE JEAN JAURES, 60290 RANTIGNY;60290;;;Crédit Agricole - Brie Picardie
Agence bancaire REBAIS;11 PLACE DU MARCHE, 77510 REBAIS;77510;;;Crédit Agricole - Brie Picardie
Agence bancaire RESSONS SUR MATZ;10 RUE GEORGES LATAPIE, 60490 RESSONS SUR MATZ;60490;;;Crédit Agricole - Brie Picardie
Agence bancaire RIBECOURT;35 RUE ARISTIDE BRIAND, 60170 RIBECOURT;60170;;;Crédit Agricole - Brie Picardie
Agence bancaire ROISEL;13 RUE DU CATELET, 80240 ROISEL;80240;;;Crédit Agricole - Brie Picardie
Agence bancaire ROISSY EN BRIE;20 Avenue DU GENERAL LECLERC, 77680 ROISSY EN BRIE;77680;;;Crédit Agricole - Brie Picardie
Agence bancaire ROSIERES EN SANTERRE;17 RUE JEAN JAURES, 80170 ROSIERES EN SANTERRE;80170;;;Crédit Agricole - Brie Picardie
Agence bancaire ROYE;8 BIS BOULEVARD GENERAL LECLERC, 80700 ROYE;80700;;;Crédit Agricole - Brie Picardie
Agence bancaire ROZAY EN BRIE;42 RUE DU GENERAL LECLERC, 77540 ROZAY EN BRIE;77540;;;Crédit Agricole - Brie Picardie
Agence bancaire RUBELLES;4 rue du Perré - Centre d'activités Saint Nicolas, 77950 RUBELLES;77950;;;Crédit Agricole - Brie Picardie
Agence bancaire RUE;27 AVENUE DES FRERES CAUDRON, 80120 RUE;80120;;;Crédit Agricole - Brie Picardie
Agence bancaire SAINT GERMAIN SUR MORIN;12,16 PLACE DE LA MAIRIE, 77860 SAINT GERMAIN SUR MORIN;77860;;;Crédit Agricole - Brie Picardie
Agence bancaire SAINT  JUST EN CHAUSSEE;33 RUE DE PARIS, 60130 SAINT JUST EN CHAUSSEE;60130;;;Crédit Agricole - Brie Picardie
Agence bancaire SAINT LEU D'ESSERENT;8 ter place de la République, 60340 SAINT LEU D'ESSERENT;60340;;;Crédit Agricole - Brie Picardie
Agence bancaire SAINT MARD;10 avenue de la Gare, 77230 SAINT MARD;77230;;;Crédit Agricole - Brie Picardie
Agence bancaire SAINT PATHUS;CENTRE COMMERCIAL LES SOURCES, 77178 SAINT PATHUS;77178;;;Crédit Agricole - Brie Picardie
Agence bancaire ST PIERRE LES NEMOURS;4 RUE DU CLOS ST JEAN, 77140 SAINT PIERRE LES NEMOURS;77140;;;Crédit Agricole - Brie Picardie
Agence bancaire SAINT RIQUIER;8 RUE DE L'HOPITAL, 80135 SAINT RIQUIER;80135;;;Crédit Agricole - Brie Picardie
Agence bancaire SAINT SOUPPLETS;46 RUE DU GENERAL MAUNOURY, 77165 SAINT SOUPPLETS;77165;;;Crédit Agricole - Brie Picardie
Agence bancaire SAINT VALERY SUR SOMME;20 QUAI DU ROMEREL, 80230 SAINT VALERY SUR SOMME;80230;;;Crédit Agricole - Brie Picardie
Agence bancaire PONTHIERRY;50 Avenue Albert Beaufils, 77310 SAINT-FARGEAU-PONTHIERRY;77310;;;Crédit Agricole - Brie Picardie
Agence bancaire SALOUEL;116 Rue du 8 Mai 1945, 80480 SALOUEL;80480;;;Crédit Agricole - Brie Picardie
Agence bancaire SAVIGNY LE TEMPLE;Centre Commercial du miroir d'eau, 77176 SAVIGNY LE TEMPLE;77176;48,5751872;2,5831332;Crédit Agricole - Brie Picardie
Agence bancaire SAVIGNY MEDIATHEQUE;12 place Paul Desphelipon, 77176 SAVIGNY LE TEMPLE;77176;48,5812479;2,5838257;Crédit Agricole - Brie Picardie
Agence bancaire SENLIS;81 RUE DE LA REPUBLIQUE, 60300 SENLIS;60300;49,2047676;2,5870991;Crédit Agricole - Brie Picardie
Agence bancaire SENLIS CENTRE D'AFFAIRES ENTREPRISES;81 rue de la république, 60300 SENLIS;60300;49,205014;2,586858;Crédit Agricole - Brie Picardie
Agence bancaire SERRIS;9 COURS DE L'ELBE, 77700 SERRIS;77700;;;Crédit Agricole - Brie Picardie
Agence bancaire SONGEONS;41 PLACE DE LA HALLE, 60380 SONGEONS;60380;;;Crédit Agricole - Brie Picardie
Agence bancaire SOUPPES SUR LOING;5 RUE DE LA REPUBLIQUE, 77460 SOUPPES SUR LOING;77460;;;Crédit Agricole - Brie Picardie
Agence bancaire LAGNY GARE;7 rue du Maréchal Foch, 77400 THORIGNY SUR MARNE;77400;;;Crédit Agricole - Brie Picardie
Agence bancaire THOUROTTE;3 AVENUE JEAN JAURES, 60150 THOUROTTE;60150;;;Crédit Agricole - Brie Picardie
Agence bancaire TORCY;66 BIS,68 RUE DE PARIS, 77200 TORCY;77200;;;Crédit Agricole - Brie Picardie
Agence bancaire TOURNAN EN BRIE;42 RUE DE PARIS, 77220 TOURNAN EN BRIE;77220;;;Crédit Agricole - Brie Picardie
Agence bancaire TRICOT;40 GRANDE RUE, 60420 TRICOT;60420;;;Crédit Agricole - Brie Picardie
Agence bancaire TRILPORT;12 rue DU MARECHAL JOFFRE, 77470 TRILPORT;77470;;;Crédit Agricole - Brie Picardie
Agence bancaire VAIRES SUR MARNE;12 BOULEVARD DE LORRAINE, 77360 VAIRES SUR MARNE;77360;;;Crédit Agricole - Brie Picardie
Agence bancaire VAUX LE PENIL;AVENUE DE GAULLE-C.CIAL MOUSTIERS, 77530 VAUX LE PENIL;77530;;;Crédit Agricole - Brie Picardie
Agence bancaire VERBERIE;2 PLACE DU GENERAL DE GAULLE, 60410 VERBERIE;60410;;;Crédit Agricole - Brie Picardie
Agence bancaire VIGNACOURT;151 RUE GODARD DUBUC, 80650 VIGNACOURT;80650;;;Crédit Agricole - Brie Picardie
Agence bancaire VILLEPARISIS DE GAULLE;162 AVENUE GENERAL DE GAULLE, 77270 VILLEPARISIS;77270;48,9493274;2,6041784;Crédit Agricole - Brie Picardie
Agence bancaire VILLEPARISIS JEAN JAURES;32 RUE JEAN JAURES, 77270 VILLEPARISIS;77270;48,9384677;2,6072611;Crédit Agricole - Brie Picardie
Agence bancaire VILLERS BOCAGE;PLACE DU 11 NOVEMBRE, 80260 VILLERS BOCAGE;80260;;;Crédit Agricole - Brie Picardie
Agence bancaire VILLERS BRETONNEUX;8 BIS RUE DE MELBOURNE, 80380 VILLERS BRETONNEUX;80380;;;Crédit Agricole - Brie Picardie
Agence bancaire VILLERS SAINT PAUL;15 RUE JULES UHRY, 60870 VILLERS SAINT PAUL;60870;;;Crédit Agricole - Brie Picardie
Agence bancaire VOULX;1 RUE DE L'ILE, 77940 VOULX;77940;;;Crédit Agricole - Brie Picardie
Agence bancaire VULAINES SUR SEINE;44 ROUTE D'HERICY, 77870 VULAINES SUR SEINE;77870;;;Crédit Agricole - Brie Picardie
